{
  "version": "1.0",
  "variant": "schedule",
  "status": "success",
  "title": "教师003 · 第1-2周课表",
  "subtitle": "教师003 · 第1-2周",
  "verified": true,
  "summary": "第1-2周共 3 条课程。",
  "context": "第1-2周",
  "sections": [],
  "actions": [
    {
      "id": "schedule-followup",
      "type": "sys.chat",
      "label": "检查这两周的风险",
      "payload": { "query": "检查教师003第1-2周是否存在时间冲突或跨校区赶场" }
    },
    {
      "id": "schedule-week",
      "type": "sys.chat",
      "label": "看下一个教学周",
      "payload": { "query": "查看教师003第3周的课表" }
    },
    {
      "id": "weekboard-day-detail",
      "type": "sys.chat",
      "label": "看周一明细",
      "payload": { "query": "查看教师003第1-2周周一的课表明细" }
    }
  ],
  "displayMeta": {},
  "layoutMode": "week-board",
  "weekBoardTitle": "教师003 · 第1-2周课表",
  "weekBoardSubtitle": "教师003 · 第1-2周",
  "days": [
    {
      "label": "周一",
      "blocks": [
        {
          "time": "第1-2节",
          "title": "高等数学",
          "location": "校区A A4-101",
          "meta": "08:00-09:40 · 教师003 · 2025级A班 · 第1-2周"
        }
      ]
    },
    {
      "label": "周三",
      "blocks": [
        {
          "time": "第3-4节",
          "title": "操作系统",
          "location": "校区B B1-205",
          "meta": "10:00-11:40 · 教师003 · 2025级B班 · 第2周"
        }
      ]
    },
    {
      "label": "周五",
      "blocks": [
        {
          "time": "第5-6节",
          "title": "数据库原理",
          "location": "校区A A2-303",
          "meta": "14:00-15:40 · 教师003 · 2025级A班 · 第1-2周"
        }
      ]
    }
  ]
}
